{
  "schema_version": "courseplay-a-page/v4",
  "document_kind": "production",
  "episode_id": "episode-02",
  "approved_text": "approved-spoken-text.txt",
  "timing_model": {
    "han_weight": 1,
    "fullwidth_punctuation_weight": 0,
    "other_non_whitespace_weight": 0.5,
    "chars_per_minute": {
      "minimum": 220,
      "target": 230,
      "maximum": 240
    }
  },
  "evidence_catalog": [
    {
      "evidence_id": "E001",
      "claim_or_asset": "第 02 集负责网络、平台、数据、安全及数据闭环；第 01、03–06 集的相邻边界",
      "source_locator": "course-video-architecture.md，第 5 节第 02 集；第 6 节规则 1–3",
      "verification_status": "not applicable",
      "allowed_use": "确定本集责任、前置和排除范围"
    },
    {
      "evidence_id": "E002",
      "claim_or_asset": "网络是基础、平台是关键、数据是核心、安全是保障及各自职责",
      "source_locator": "1.1 工业互联网认知.md，1.1.1“4. 工业互联网体系构成”四个项目符号",
      "verification_status": "not applicable",
      "allowed_use": "解释四体系的功能边界"
    },
    {
      "evidence_id": "E003",
      "claim_or_asset": "物理系统与数字空间协同；设备资产、生产系统、管理系统、供应链条贯通；IT 与 OT 融合",
      "source_locator": "同上，“4. 工业互联网体系构成”末段前半",
      "verification_status": "not applicable",
      "allowed_use": "解释四体系协同后的整体作用"
    },
    {
      "evidence_id": "E004",
      "claim_or_asset": "感知控制、数字模型、决策优化三个层次；上行信息流和下行决策流构成优化闭环",
      "source_locator": "同上，“4. 工业互联网体系构成”末句",
      "verification_status": "not applicable",
      "allowed_use": "建立本集闭环主机制"
    },
    {
      "evidence_id": "E005",
      "claim_or_asset": "智能化生产、网络化协同、服务化延伸、个性化定制、数字化管理五类应用模式",
      "source_locator": "1.1 工业互联网认知.md，1.1.1“3. 工业互联网的意义”表 1-1",
      "verification_status": "not applicable",
      "allowed_use": "作为闭环落点的压缩式概览"
    },
    {
      "evidence_id": "E006",
      "claim_or_asset": "四体系不是四个并列名词，而是一条从连接、承载、数据驱动到安全保障的协同链",
      "source_locator": "E002–E004",
      "verification_status": "not applicable",
      "allowed_use": "组织讲稿与关系图"
    },
    {
      "evidence_id": "E007",
      "claim_or_asset": "“产线已联网、数据持续上报，但异常仍靠人工发现”的开篇情境",
      "source_locator": "本任务包原创",
      "verification_status": "not applicable",
      "allowed_use": "用于提出“连接为何还没有形成闭环”的问题"
    },
    {
      "evidence_id": "E008",
      "claim_or_asset": "教材图像实际为工业互联网产生时间轴",
      "source_locator": "教材配图，全图",
      "verification_status": "not applicable",
      "allowed_use": "仅用于识别重复标图风险"
    }
  ],
  "pages": [
    {
      "a_id": "A001",
      "callback_a_ids": [],
      "nx": "设想一条已经联网的产线。设备不断上传状态信息，可一旦出现异常，还是要等现场人员发现，再打电话沟通，由不同的人和系统分头处理。信息已经传出去了，生产过程却没有因此得到及时改善。问题在哪里？连接只能让信息开始流动，还需要有人接住信息、理解变化，并把判断带回生产现场。\n\n",
      "teaching_purpose": "以教学情境暴露“已联网但未改善”的开环问题。",
      "single_message": "信息已经从产线传出，但异常仍靠人工发现和分头处理，说明连接本身不等于闭环。",
      "must_visible": [
        {
          "semantic_item_id": "V001",
          "meaning": "明确标注为教学情境的已联网产线、持续上传状态与仍靠人工处置",
          "evidence_refs": [
            "E007"
          ]
        },
        {
          "semantic_item_id": "V002",
          "meaning": "信息上行而返回生产的行动路径尚未建立",
          "evidence_refs": [
            "E001",
            "E007"
          ]
        }
      ],
      "protected_relations": [
        {
          "relation_id": "R001",
          "from": "产线状态信息",
          "relation": "持续上传但未形成",
          "to": "返回生产现场的及时行动",
          "direction": "forward"
        }
      ],
      "entry_condition": "观众进入一条已联网产线的设想情境。",
      "exit_condition": "观众能区分信息传出与生产闭环。",
      "timing": {
        "char_equivalent": 118,
        "min_seconds": 30,
        "target_seconds": 31,
        "max_seconds": 33,
        "short_page_reason": null
      }
    },
    {
      "a_id": "A002",
      "callback_a_ids": [
        "A001"
      ],
      "nx": "这就带来一个关键问题：设备和业务系统联网以后，网络、平台、数据和安全怎样配合，才能让信息变成行动，再从行动中产生新的信息？理解这件事，可以沿着一次真实的生产变化来观察。\n\n",
      "teaching_purpose": "把开环情境收束为本集要追踪的协同问题。",
      "single_message": "网络、平台、数据和安全必须共同让信息变成行动，并让行动产生的新信息再次回流。",
      "must_visible": [
        {
          "semantic_item_id": "V003",
          "meaning": "网络、平台、数据、安全共同参与从信息到行动再到新信息的路径",
          "evidence_refs": [
            "E001",
            "E007"
          ]
        }
      ],
      "protected_relations": [
        {
          "relation_id": "R002",
          "from": "信息",
          "relation": "被理解并转化为",
          "to": "行动",
          "direction": "forward"
        },
        {
          "relation_id": "R003",
          "from": "行动",
          "relation": "产生",
          "to": "新的生产信息",
          "direction": "forward"
        }
      ],
      "entry_condition": "观众已看到联网产线仍依赖人工处置。",
      "exit_condition": "观众带着四体系如何形成闭环的问题进入机制解释。",
      "timing": {
        "char_equivalent": 75,
        "min_seconds": 19,
        "target_seconds": 20,
        "max_seconds": 21,
        "short_page_reason": null
      }
    },
    {
      "a_id": "A003",
      "callback_a_ids": [],
      "nx": "网络提供了这条路径的基础。它把工厂内外的设备、生产系统、管理系统，以及供应链中相关的环节连接起来。设备状态和业务活动只有能够持续传递，生产过程的变化才不会被困在某个局部。没有连接，后面的理解和判断就失去了入口。\n\n",
      "teaching_purpose": "建立网络作为信息路径基础的职责。",
      "single_message": "网络连接工厂内外对象并持续传递状态与业务信息，为后续理解和判断提供入口。",
      "must_visible": [
        {
          "semantic_item_id": "V004",
          "meaning": "网络连接设备、生产系统、管理系统和供应链相关环节",
          "evidence_refs": [
            "E002",
            "E003"
          ]
        }
      ],
      "protected_relations": [
        {
          "relation_id": "R004",
          "from": "工业对象与相关环节",
          "relation": "经网络连接并传递",
          "to": "状态和业务信息",
          "direction": "forward"
        }
      ],
      "entry_condition": "观众已明确要追踪信息如何变成行动。",
      "exit_condition": "观众理解没有网络连接就没有后续处理入口。",
      "timing": {
        "char_equivalent": 96,
        "min_seconds": 24,
        "target_seconds": 25,
        "max_seconds": 27,
        "short_page_reason": null
      }
    },
    {
      "a_id": "A004",
      "callback_a_ids": [
        "A003"
      ],
      "nx": "信息进入共同环境之后，还需要平台来承接。平台可以理解成把资源和能力组织起来的共同空间。它汇聚制造资源与能力，为数据处理、数字模型、应用服务和业务协同提供支撑。这样，分散在不同环节的能力才有机会被放在一起使用，而不是各自保存、各自处理。\n\n",
      "teaching_purpose": "建立平台对资源和能力的共同承载职责。",
      "single_message": "平台汇聚制造资源与能力，为处理、模型、应用和协同提供共同空间。",
      "must_visible": [
        {
          "semantic_item_id": "V005",
          "meaning": "平台汇聚制造资源与能力，并承载数据处理、数字模型、应用服务和业务协同",
          "evidence_refs": [
            "E002",
            "E003"
          ]
        }
      ],
      "protected_relations": [
        {
          "relation_id": "R005",
          "from": "网络送来的工业要素",
          "relation": "由平台汇聚并组织",
          "to": "处理、模型、应用与协同能力",
          "direction": "forward"
        }
      ],
      "entry_condition": "观众已看到信息能够从局部持续传递。",
      "exit_condition": "观众理解平台不是单纯存放数据，而是组织可复用能力。",
      "timing": {
        "char_equivalent": 106,
        "min_seconds": 27,
        "target_seconds": 28,
        "max_seconds": 29,
        "short_page_reason": null
      }
    },
    {
      "a_id": "A005",
      "callback_a_ids": [],
      "nx": "数据是这条路径中的核心。设备状态、生产过程和业务活动会不断形成信息。这些信息经过持续采集、处理、必要的治理和使用，才可能被人和系统理解。数据不是停在某个环节的记录，而是贯穿感知、建模、判断和反馈的主线。这里关注的是它如何推动理解和优化，不展开数据分类、共享制度或具体建模方法。\n\n",
      "teaching_purpose": "建立数据贯穿感知、建模、判断和反馈的核心职责。",
      "single_message": "持续形成的信息经采集、处理、必要治理和使用后，才能成为理解与优化的依据。",
      "must_visible": [
        {
          "semantic_item_id": "V006",
          "meaning": "数据从采集、处理、必要治理到使用，并贯穿感知、建模、判断和反馈",
          "evidence_refs": [
            "E002",
            "E004"
          ]
        }
      ],
      "protected_relations": [
        {
          "relation_id": "R006",
          "from": "生产与业务信息",
          "relation": "经采集处理和必要治理后支持",
          "to": "理解、判断与反馈",
          "direction": "forward"
        }
      ],
      "entry_condition": "观众已理解网络和平台提供路径与承载。",
      "exit_condition": "观众理解数据是驱动后续机制的核心主线。",
      "timing": {
        "char_equivalent": 124,
        "min_seconds": 31,
        "target_seconds": 32,
        "max_seconds": 34,
        "short_page_reason": null
      }
    },
    {
      "a_id": "A006",
      "callback_a_ids": [
        "A005"
      ],
      "nx": "安全则要一直在场。设备、网络、应用和数据都需要受到保护。可靠性让信息和服务能够持续工作；保密性防止不该看到的内容被暴露；完整性保证信息没有被不当改变；可用性保证需要时能够正常使用。安全不是流程结束时才加上的一道门，而是让整条信息路径能够可信运行的条件。\n\n",
      "teaching_purpose": "建立安全覆盖全程而非末端补充的保障职责。",
      "single_message": "可靠性、保密性、完整性和可用性共同保障设备、网络、应用和数据可信运行。",
      "must_visible": [
        {
          "semantic_item_id": "V007",
          "meaning": "安全覆盖设备、网络、应用和数据，并保护可靠性、保密性、完整性和可用性",
          "evidence_refs": [
            "E002",
            "E004"
          ]
        }
      ],
      "protected_relations": [
        {
          "relation_id": "R007",
          "from": "安全保障",
          "relation": "全过程覆盖",
          "to": "设备、网络、应用和数据",
          "direction": "forward"
        }
      ],
      "entry_condition": "观众已看到数据贯穿处理与反馈。",
      "exit_condition": "观众理解安全必须从连接开始持续在场。",
      "timing": {
        "char_equivalent": 116,
        "min_seconds": 29,
        "target_seconds": 30,
        "max_seconds": 32,
        "short_page_reason": null
      }
    },
    {
      "a_id": "A007",
      "callback_a_ids": [],
      "nx": "把这几项职责放在一起看，它们并不是互不相干的名词。网络负责连接和传递；平台负责汇聚资源与能力；数据让系统有了理解和优化的依据；安全让整个过程能够稳定、可信地持续运行。少了网络，信息传不上来；少了平台，分散的能力难以协同；少了数据，判断没有根据；少了安全，信息和行动就难以放心地持续运行。\n\n生产现场与数字空间也在这条路径上相互配合。",
      "teaching_purpose": "把四项职责合成为协同链并呈现缺失后果；从四体系协同链过渡到生产现场与数字空间的配合。",
      "single_message": "网络连接、平台汇聚、数据驱动、安全保障相互依赖，任一缺位都会造成闭环断点。 四体系的协同最终连接生产现场与数字空间。",
      "must_visible": [
        {
          "semantic_item_id": "V008",
          "meaning": "网络、平台、数据、安全的完整职责链",
          "evidence_refs": [
            "E002",
            "E003",
            "E006"
          ]
        },
        {
          "semantic_item_id": "V009",
          "meaning": "四项职责分别缺失时对应的信息、能力、判断或可信运行断点",
          "evidence_refs": [
            "E002",
            "E003",
            "E006"
          ]
        },
        {
          "semantic_item_id": "V010",
          "meaning": "生产现场与数字空间位于同一协同路径的两端",
          "evidence_refs": [
            "E003"
          ]
        }
      ],
      "protected_relations": [
        {
          "relation_id": "R008",
          "from": "网络连接与平台汇聚",